{
  "program_id": "202603237504150010",
  "sensor_type": "thermal-camera",
  "source_file": "Channel_0_11_ 2026-04-13 14_31_40_303.csv",
  "start_time": "2026-04-13 14:31:40:343",
  "end_time": "2026-04-13 15:20:32:641",
  "sample_count": 73114,
  "g_high_min": 65.86,
  "g_high_max": 1321.96,
  "g_high_avg": 248.89,
  "thermal_trace": [
    {
      "time": "2026-04-13 14:31:40:343",
      "g_high": 640.98
    },
    {
      "time": "2026-04-13 14:31:40:381",
      "g_high": 629.70
    },
    {
      "time": "2026-04-13 14:31:40:423",
      "g_high": 614.22
    },
    {
      "time": "2026-04-13 14:31:40:462",
      "g_high": 749.32
    },
    {
      "time": "2026-04-13 14:31:40:504",
      "g_high": 920.95
    }
  ]
}
